date,id,title,content,tag
20100219,20100219-9,新华社发表署名文章：达赖挟洋自重必然失败,新华社今天发表益多的署名文章《达赖挟洋自重必然失败》。文章说，借助外国势力使所谓“西藏问题”国际化，对中国政府施加压力，最终实现“西藏独立”，这一图谋贯穿十四世达赖喇嘛五十多年流亡生涯。达赖及其“流亡政府”没有任何合法性，没有任何资格代表西藏地方和西藏人民，世界上迄今也没有任何国家承认这个“流亡政府”，任何外国政要以任何借口会见达赖，都是对这个以分裂中国为目的的非法政治组织的支持。达赖以为挑拨、破坏中国与有关国家的关系就可以起到对中央施压的作用，这种行径只会恶化同中央的关系，只会激起全国人民更强烈的反感，最终自己种下的苦果还得他自己尝！相关报道奥巴马会见达赖 中国外交部发言人就此发表谈话美国东部时间２月１８号，美方无视中方多次严正交涉，执意安排美国总统奥巴马在白宫地图室会见达赖。中国外交部发言人马朝旭今天凌晨就此发表谈话指出，美方的行为严重违背国际关系基本准则，违反中美三个联合公报和《中美联合声明》确定的原则，违背美国政府多次重申的承认西藏是中国一部分、不支持“西藏独立”的承诺。马朝旭说，中方对此表示强烈不满和坚决反对。中方要求美方认真对待中方立场，立即采取有效措施消除恶劣影响，停止纵容和支持“藏独”反华分裂势力，停止干涉中国内政，以实际行动维护中美关系健康稳定发展。?>>>>点击详细奥巴马无视中方反对会见达赖新华网华盛顿2月18日电 美国总统奥巴马不顾中国方面的强烈反对，18日在华盛顿会见了达赖。中方此前已就奥巴马将会见达赖的问题多次向美方提出严正交涉。外交部发言人马朝旭12日表示，中方坚决反对达赖窜访美国，反对美国领导人与达赖进行接触。中方敦促美方充分认清涉藏问题的高度敏感性，恪守承认西藏是中国一部分、反对“西藏独立”的承诺，不为达赖从事反华分裂活动提供任何场所和便利，以免给中美关系造成进一步损害。? >>>>点击详细美国国务卿希拉里?克林顿会见达赖美国国务卿希拉里?克林顿18日在华盛顿会见了达赖。当天早些时候，美国总统奥巴马不顾中国方面的强烈反对，在华盛顿会见了达赖。 >>>>点击详细美华人纷纷抗议奥巴马见达赖美国各地侨领18日纷纷发表讲话或声明，抗议奥巴马执意在白宫会见达赖。侨领们认为，奥巴马做了一个错误的选择，势必影响中美关系，希望美方采取有效措施消除恶劣影响。华盛顿中国和平统一促进会会长吴惠秋表示，达赖喇嘛一直从事着企图分裂中国的活动。世界上没有一个国家能够允许破坏主权和领土完整的行为，美国也不例外。这就是为什么全世界的中国人都对达赖分裂祖国的行为表示强烈愤慨和坚决反对的原因。 >>>>点击详细分析评论新华社发表署名文章：达赖挟洋自重必然失败新华社今天发表益多的署名文章《达赖挟洋自重必然失败》。文章说，借助外国势力使所谓“西藏问题”国际化，对中国政府施加压力，最终实现“西藏独立”，这一图谋贯穿十四世达赖喇嘛五十多年流亡生涯。达赖及其“流亡政府”没有任何合法性，没有任何资格代表西藏地方和西藏人民，世界上迄今也没有任何国家承认这个“流亡政府”，任何外国政要以任何借口会见达赖，都是对这个以分裂中国为目的的非法政治组织的支持。 >>>>点击详细奥巴马见达赖：各有所图对奥巴马不顾中国的强烈反对和多次交涉，会见达赖。新华社今天发表特稿文章进行分析，题目是《奥巴马见达赖：各有所图》。新华社文章称，国际舆论认为，奥巴马会见达赖，背后有着复杂的国内国际政治目的。而达赖则希望通过见奥巴马，以宗教外衣为伪装，推销其分裂祖国的政治图谋。在奥巴马上任之前，美国两党三位总统已会见达赖共１１次。奥巴马打着“变革”旗号上台，但在会见达赖问题上却并未“变革”。 >>>>点击详细,国外
20180925,20180925-12,普京：向叙提供S-300为保证俄军安全,24日，俄罗斯总统普京与以色列总理内塔尼亚胡通电话，在谈及向叙利亚提供S－300防空导弹系统时，普京表示，俄方决定协助叙军提高防空能力的做法是适当的。据克里姆林宫发布的消息，普京表示，俄罗斯已决定协助叙军提高防空能力，这一做法在当前形势下是适当的。普京说，俄方首先是为了防止在叙利亚打击国际恐怖主义的俄罗斯军人的生命受到任何潜在威胁。普京还说，以色列空军针对叙利亚的行动是造成俄军飞机被击落的主要原因，以方发布的以色列战机活动信息与俄罗斯国防部的结论不符。而据以色列总理办公室的声明，内塔尼亚胡对普京说，他相信以色列国防军声明的真实性。他重申俄罗斯军机被击落的责任在叙利亚军方以及叙境内的伊朗军事力量。此前，以色列国防军发表声明说，俄军机被击落时，以战机并没有躲藏在其后面，当时以方战机正处在以色列领空。俄罗斯国防部长绍伊古24日说，俄方数年前曾打算向叙军提供S－300防空导弹系统，但由于以色列方面的反对而暂停实施，不过目前，与此相关的叙利亚局势已然改变。除提供S－300防空导弹系统之外，绍伊古还宣布将向叙利亚政府军提供多个自动指挥系统和电子战支援，以提高叙军防空战力。,国外
20100219,20100219-8,外交部发言人马朝旭就美国总统奥巴马会见达赖发表谈话,外交部发言人马朝旭今天就美国总统奥巴马会见达赖发表谈话。马朝旭说，美国东部时间2月18日，美方无视中方多次严正交涉，执意安排美国总统奥巴马在白宫地图室会见达赖，美国国务卿希拉里?克林顿也于同日会见了达赖。美方的行为严重干涉中国内政，严重伤害中国人民的民族感情，严重损害中美关系。中国外交部副部长崔天凯已召见美国驻华大使洪博培提出严正交涉。马朝旭说，西藏是中国领土神圣不可分割的一部分，西藏事务纯属中国内政。中方坚决反对任何国家的领导人和政府官员以任何形式会见达赖，坚决反对任何国家、任何人以任何借口利用达赖问题干涉中国内政。达赖几十年的言行表明，他不是一个单纯的宗教人士，而是打着宗教旗号长期从事反华分裂活动的政治流亡者。美方允许达赖窜访美国并安排领导人和其他政要会见，严重违背国际关系基本准则，违反中美三个联合公报和《中美联合声明》确定的原则，违背美国政府多次重申的承认西藏是中国一部分、不支持“西藏独立”的承诺。中方对此表示强烈不满和坚决反对。中国政府和人民捍卫国家主权和领土完整的决心是坚定不移的，任何人企图利用达赖问题干涉中国内政都是不会得逞的。中方要求美方认真对待中方立场，立即采取有效措施消除恶劣影响，停止纵容和支持“藏独”反华分裂势力，停止干涉中国内政，以实际行动维护中美关系健康稳定发展。相关报道奥巴马无视中方反对会见达赖新华网华盛顿2月18日电 美国总统奥巴马不顾中国方面的强烈反对，18日在华盛顿会见了达赖。中方此前已就奥巴马将会见达赖的问题多次向美方提出严正交涉。外交部发言人马朝旭12日表示，中方坚决反对达赖窜访美国，反对美国领导人与达赖进行接触。中方敦促美方充分认清涉藏问题的高度敏感性，恪守承认西藏是中国一部分、反对“西藏独立”的承诺，不为达赖从事反华分裂活动提供任何场所和便利，以免给中美关系造成进一步损害。? >>>>点击详细美国国务卿希拉里?克林顿会见达赖美国国务卿希拉里?克林顿18日在华盛顿会见了达赖。当天早些时候，美国总统奥巴马不顾中国方面的强烈反对，在华盛顿会见了达赖。 >>>>点击详细美华人纷纷抗议奥巴马见达赖美国各地侨领18日纷纷发表讲话或声明，抗议奥巴马执意在白宫会见达赖。侨领们认为，奥巴马做了一个错误的选择，势必影响中美关系，希望美方采取有效措施消除恶劣影响。华盛顿中国和平统一促进会会长吴惠秋表示，达赖喇嘛一直从事着企图分裂中国的活动。世界上没有一个国家能够允许破坏主权和领土完整的行为，美国也不例外。这就是为什么全世界的中国人都对达赖分裂祖国的行为表示强烈愤慨和坚决反对的原因。 >>>>点击详细分析评论新华社发表署名文章：达赖挟洋自重必然失败新华社今天发表益多的署名文章《达赖挟洋自重必然失败》。文章说，借助外国势力使所谓“西藏问题”国际化，对中国政府施加压力，最终实现“西藏独立”，这一图谋贯穿十四世达赖喇嘛五十多年流亡生涯。达赖及其“流亡政府”没有任何合法性，没有任何资格代表西藏地方和西藏人民，世界上迄今也没有任何国家承认这个“流亡政府”，任何外国政要以任何借口会见达赖，都是对这个以分裂中国为目的的非法政治组织的支持。 >>>>点击详细奥巴马见达赖：各有所图对奥巴马不顾中国的强烈反对和多次交涉，会见达赖。新华社今天发表特稿文章进行分析，题目是《奥巴马见达赖：各有所图》。新华社文章称，国际舆论认为，奥巴马会见达赖，背后有着复杂的国内国际政治目的。而达赖则希望通过见奥巴马，以宗教外衣为伪装，推销其分裂祖国的政治图谋。在奥巴马上任之前，美国两党三位总统已会见达赖共１１次。奥巴马打着“变革”旗号上台，但在会见达赖问题上却并未“变革”。 >>>>点击详细,国外
20180925,20180925-11,国内联播快讯,31个省份一般工商业销售电价普降10%记者今天从国家发改委获悉，截止到9月21日，全国31个省份一般工商业销售电价普降10%。综合其它降价清费措施，全年可减少一般工商业企业电费支出超过1000亿元。浙江军民举行人防应急演练近日，浙江省、市、县区、乡镇四级联动，采取室内推演与现场实兵相结合的方式，组织军民临战疏散，伪装防护，并就重要目标遭遇空袭、建筑坍塌等多种特情展开救援演练，深化新形势下人民防空实战能力。壶口瀑布现“水岸齐平”壮美景观受连续降水影响，黄河壶口瀑布近期水量大增，达到日常流量的7倍左右，出现“水岸齐平”的壮观景象。从空中俯瞰，壶口瀑布的黄河水，如万马奔腾、呼啸而下，形成绵延数百米、阶梯式的瀑布群。,国外
20100219,20100219-7,【对话2010】就业组合拳促大学生就业,人力资源和社会保障部公布的数据显示，2010年仅应届高校毕业生就将达到创历史新高的631万人，国家将出台多项措施力促大学生就业。郭燕，北京联合大学老师，记者见到她时，她正在给学生上面试技巧课。她的女儿今年也要大学毕业了。关注大学生就业的不仅只有家长。2010年，国家政策将进一步引导大学生到基层工作。2010年国家将在场地费用、行政性收费减免以及小额担保贷款等方面为大学生创业保驾护航。展望2010，我国将创建86个首批国家级创业城市，鼓励和支持自主创业和自谋职业。展望2010，我国将大力实施创业培训计划，国家就业专项资金将给予补贴。展望2010，我国将延续实施“五缓四减三补贴”政策，帮助企业减轻负担稳定就业。,国外
20180925,20180925-10,经远舰水下考古调查获得重要发现,今天，历时两个多月的经远舰水下考古调查接近尾声。截至目前总计出水各类遗物标本500余件，种类十分丰富。作为近现代沉舰水下考古的又一重大发现，此次调查确定了经远舰以倒扣姿态沉没海底，右舷后部木质髹金“经远”二字清晰可见。截至目前，总计出水各类遗物标本500余件，包括铁、木、铜、铅、玻璃、陶瓷、皮革等材质，种类十分丰富，既有锅炉、舷窗、舱门、铁甲堡等舰体结构，也有白铜水烟袋、算盘珠、铜钱、砚台、马札等生活用品。特别是在船艏左侧提取了大量的毛瑟步枪子弹弹壳、37毫米炮弹、47毫米炮弹等武器装备。此外，遗址中还发现了53毫米格鲁森炮弹和120毫米炮弹底火等，均不见于“经远舰”出厂档案，推测为海战爆发前紧急添置的武器装备。1894年9月，我国黄海海域爆发了中日甲午海战。战斗中经远舰奋勇御敌，舰身多处中弹起火并在庄河附近海域沉没。,国外
20100219,20100219-6,辽宁民营企业：整合资源 化解危机,辽宁省一批拥有自主品牌的民营企业依靠技术优势和灵活的管理机制，整合资源，化解危机。连续六年在世界幕墙业保持产销量第一的沈阳远大集团，前不久主动将过去定单量最大的五个各自为政的海外工厂，调整为新组建的国际工厂下面的五个加工车间。一方面，企业的生产布局根据国际市场变化及时调整，另一方面远大也在应对危机中构建起遍布全球的营销网络。民营服装企业大杨集团抓住金融危机后欧洲本土小服装企业纷纷倒闭的市场真空，组建起国际标准服装检测中心，整合了技术与品牌优势的产品很快打入欧美市场。2009年，辽宁省民营经济实现增加值8000多亿元，同比增长20%，在金融危机中实现了逆势增长。,国外
20100219,20100219-5,新兴产业推动山东工业战略转型,山东省以新能源、新材料等新兴产业推动经济结构战略转型，从先进制造向领先制造迈进。一座大型火力发电厂的调试点火，光是燃油消耗就需要2000多吨。在山东烟台开发区的龙源电力技术股份有限公司，国内第一款自主知识产权的等离子点火器，一下子就将电厂的点火成本降低了90%以上。为推动新兴产业实现战略转型，山东省从9300多亿元的工业投资中拿出近七成用于技改创新，为新兴产业的发展安上了“加速器”。新出台的山东半岛蓝色经济区发展规划，将烟台、威海、青岛、潍坊四个制造业基础最强的城市定位为胶东半岛高端产业聚集区，引领山东从先进制造向领先制造的新一轮战略转型。,国外
20100219,20100219-4,今年全国水利投资1500多亿 重点倾向民生领域,今年全国水利投资超过1500亿元，农村饮水安全、病险水库治理等与百姓生活密切相关的民生领域将成为国家投入的重点。通上自来水，村民王玉高说，这可是他生活中的一件大事。过去天天用这手压井，累人不说，水质也无法保证。从手压井变成水龙头，这变化的背后是投入的增加。为确保水质，村里装备了检测仪器，每天都要进行十几项指标的检测。今年淮安市将在偏农村新建十几个自来水厂，最后50万农村人口饮水不安全问题将逐步得到解决。在山东莱芜市的大冶水库，大坝的除险加固正紧张进行。年久失修的大冶水库渗水严重，对下游三万多居民形成严重威胁。今年，中央水利投资继续向民生领域倾斜。今年全国将再解决6000万人农村饮水不安全问题，长江流域城陵矶蓄滞洪区、海河流域蓄滞洪区的建设将会加快进行，江西峡江、内蒙古海渤湾等一批重点骨干工程将陆续开工建设。,国外
20100219,20100219-3,社会各界深情送别著名教育家霍懋征,2月19日，中共中央政治局常委、国务院总理温家宝前往北京八宝山革命公墓送别我国当代著名教育家、首批特级教师、北京第二实验小学原副校长霍懋征，向其亲属表示慰问。新华社记者 刘卫兵 摄社会各界人士今天怀着悲痛的心情来到北京八宝山革命公墓，向我国当代著名教育家、首批特级教师、北京第二实验小学原副校长霍懋征同志的遗体告别。八宝山革命公墓礼堂庄严肃穆，哀乐低回。上午9时许，中共中央政治局常委、国务院总理温家宝，以及刘延东等缓步来到霍懋征同志遗体前肃立默哀并鞠躬，作最后送别，与亲属一一握手，表示慰问。霍懋征于2010年2月11日零时35分在北京病逝，享年88岁。霍懋征同志逝世后，中共中央政治局常委、中央书记处书记、国家副主席习近平，中共中央政治局常委、国务院副总理李克强以及刘淇、李源潮等以不同方式表示哀悼、向其亲属表示深切慰问。霍懋征1921年9月18日生于山东省济南市。1943年毕业于北京师范大学数理系，自愿赴北师大第二附属小学，即北京第二实验小学任教。霍懋征曾被评为中国现代百名教育家，她从教60年，为国家培养了大批人才，为我国教育事业作出了卓越贡献。,国外
20100219,20100219-2,【深入开展学习实践科学发展观活动】解决实际问题 确保群众满意,在深入开展学习实践科学发展观活动中，各地着力解决事关群众切身利益的实际问题，真正做到让群众满意、让百姓得实惠。在学习实践活动中，河南省郑州市上街区在党员中开展“党员星级评定”活动，设置“解困星、致富星、帮带星”等十个星级。魏岗村党员魏其水承包村里闲置的荒地建立养鸡合作社，吸纳了20多名贫困村民就业。为解决群众吃水难，四川通江县投入资金700多万元，修建引水工程，赶在春节前，开通了空山乡中坝村农村自来水配套工程，全乡7000多村民全部吃上了干净卫生的自来水。在学习实践活动中，山东莱芜市对全市村庄布局进行统一规划，用财政补贴激励旧村改造与居住区建设结合，配套完善各项服务设施。乳山市投入2000多万元，赶在春节前铺通了近6000米的海底电缆和海底淡水输送管道，岛上103户渔民吃水难、用电难的问题得到彻底解决。在学习实践活动中，甘肃庆城县把“书记县长信箱”作为与群众沟通的重要窗口，解决一些多年来的积案、难案。东王塬村和十五里铺村因为修路闹矛盾，一条路计划了十年动不了工。这件事反映到“书记县长信箱”后，县里专门成立了工作组查明原因，为占地农民落实补偿款，不到一个月，路就修通了。江苏邳州在学习实践活动中，组织近200名大学生村官成立高效农业、民营创业、三产流通工作队，帮助农民增产增收。,国外
20100219,20100219-1,【记者新春基层行】革命老区过大年,陕西延安的安塞县、河北的西柏坡，贵州的遵义，都是我国著名的红色革命圣地。如今随着经济的发展，这个新年，老区人民的日子也过得红红火火。正月里，这种走家串户打腰鼓拜年的方式叫“沿门子”，已经流传了几千年。鞭炮过后，村民们排成几个队型，先在主人家的院子里打上一阵。伞头则根据各家情况，触景生情演唱几段吉利秧歌，以表贺年之意。今天，热情的村民们也邀请我们加入。缠上红绸子、打起腰鼓，讨个新年里的好彩头。现在这条新修的马路更是直接连通延安机场，为销售大棚菜提供了最便捷的运输方式。集市上还能看到热闹的北方秧歌，以及太行山区特有的民俗歌舞――拉花，演员都来自民间，图得就是个喜庆乐呵。在当地免税收、给补贴等优惠政策的鼓励下，西柏坡80%的人家都端起了红色旅游的饭碗，收入也越来越可观。年愈古稀的韩花珍老人，靠经营农家院每年能入帐十几万元。西柏坡也从革命圣地变成旅游胜地。高唱红歌的老人们自豪的告诉我们，他们每一位成员都会唱100多首经典的红色歌曲，每天要唱20首左右。她们希望能够用这种方式将当年的革命精神传承下去。,国外
20180311,20180311-15,联播快讯,《2017寻找最美医生》颁奖典礼今晚播出《2017寻找最美医生》大型公益活动颁奖典礼今晚8点09分在央视综合频道播出，讲述医者仁心、大爱无疆的感人故事，揭晓“最美医生”“最美团队”，并致敬匿名捐款15年的海岛医生王珏。叙政府军收复东古塔一处战略要地据叙利亚媒体10日报道，叙政府军当天在东古塔地区收复一处战略要地梅斯拉巴镇，军事行动取得重要进展。被困在那里的60名平民在政府军保护下撤离。梅斯拉巴镇是连接东古塔南北区域的战略要地。夺取该地后，政府军几乎将反政府武装控制区拦腰切断，进而可以对反政府武装的重要据点哈赖斯塔形成火力包围。三百多名非法移民在利附近海域获救利比亚海军及国际慈善机构船只10日在利比亚附近海域分别对多艘偷渡船实施了救援，救起了300多名非法移民。其中一部分非法移民被送到位于利比亚首都的黎波里的海军基地，之后被移交给打击非法移民办公室。还有一部分在较远海域获救的非法移民可能被送至意大利。,国外
20160208,20160208-9,国际联播快讯,安理会强烈谴责朝鲜发射活动7号，联合国安理会就朝鲜利用弹道导弹技术进行发射一事举行紧急闭门磋商，并发表媒体声明。声明强烈谴责朝鲜利用弹道导弹技术从事发射活动，称这严重违反了安理会相关决议。安理会将迅速通过包含重要举措的新决议，为通过外交和政治方式和平解决当前局势以实现朝鲜半岛无核化而努力。朝鲜7号宣布利用运载火箭成功发射了“光明星４号”地球观测卫星。伊军在拉马迪清剿极端组织近日，伊拉克军队在拉马迪市东部郊区发动猛攻，消灭数十名极端组织武装分子，清除了极端组织埋设的部分爆炸装置，并解救了当地的受困民众。拉马迪是安巴尔省首府，是从伊拉克首都巴格达向西通往叙利亚和约旦的重要陆路通道，去年5月落入极端组织手中。伊拉克政府去年12月宣布夺回了拉马迪，但极端组织的残余势力仍在当地活动。,国外
20180311,20180311-14,国际社会：坚强领导力保障中国发展,海外各界人士认为，五年来，在习近平的带领下，中国共产党领导中国取得了令人瞩目的发展成就。今年两会期间，“习近平新时代中国特色社会主义思想”“贯彻新发展理念”等十九大确定的重大理论观点如何指导新时代的中国发展，成为国际社会关注的焦点。还有不少海外人士认为，中国的社会经济发展所取得的成就，已经在世界范围内产生了巨大的影响力。,国内
20160208,20160208-8,四海过大年 共庆猴年新春,连日来，美国、澳大利亚、比利时等国都举行庆祝活动，共贺中国新春。6号，“欢乐春节·艺术中国汇”系列活动再度登临纽约，为美国人民带来了猴年新春的祝福。此次活动的重点项目是纽约国际艺术与创意博览会。博览会邀请中美两国艺术家共同参展，通过多种形式，从不同角度呈现当代艺术，体现“用艺术理解中国”的主题。博览会上首次以数字化形式展出了《写生珍禽图》等三幅名画，可以让观众“触摸”中国艺术。6号晚，名为“心像之音”的焰火秀在美国纽约市中心的哈得孙河上绽放，今年的春节焰火设计融入了“金猴”、山水自然意象等富有中华文化特色的元素。帝国大厦今年也再次点亮红灯，庆祝猴年。澳大利亚的经典地标建筑——悉尼歌剧院今年再次披上了中国红。悉尼市政厅、环形码头火车站大楼等主要城市建筑也进行了亮灯活动。从6号到21号，悉尼市内将举办灯展、美食节、文艺演出、龙舟竞赛等80多场充满中国文化韵味的活动，预计将吸引60多万观众。比利时首都布鲁塞尔的市政厅6号升起鲜艳的五星红旗，著名雕塑尿童小于连也换上了富有中国特色的传统服装。当天，布鲁塞尔举行了首次春节巡游活动，华侨华人和从国内赶来的艺术团体一起，向当地人民传递中国春节的欢乐气氛。,国内
